"a-profile-name","a-icon-alt","a-size-base","a-size-base 2","a-size-mini","a-size-base 3","a-size-base 4","a-button-text href","cr-helpful-text","a-size-base 5","a-size-base href 2","a-size-base 6","review-comment-count","a-alert-heading"
"NJ","3.0 颗星，最多 5 颗星","Read for a different sort of lessons","2021年7月22日 在美国审核","","Reading The Party about a decade since its publication throws good light on issues raised by perennial China skeptics. The book is informative in its details on CCP's hold over life and everything else in China. Its absolutism is laudatory at a level, even though most readers will wonder if the author - and similar commentators - would apply the same brush to nations and governments strategically more important to their host nations.The main conclusions are elsewhere. There is no dearth of experts uneasy with the Chinese ways ever since its growth started drawing their attention, particularly from the Tiananmen protests. Almost all have forecasted an imminent political and economic collapse stressing the unsustainability of the Chinese ways while excessively drawing on the mistakes of the Mao times.China will have ups and downs in the years ahead. The downcycles will be different from those elsewhere, even if equally or more/less painful, characterized by the Party's unique structure. And yet, three things are lost in the analysis of the kind presented in the book.One, every system in the world is unique and causes its community to go through its distinctive cycles. This is not to say some systems are not more wrong, but a perspective on any success matter to analyze any predicted doom. None of the forecasted collapses of China have come to a pass so far. Books of the kind must discuss what has allowed the party to go on so long before turning to incremental changes that could lead to a complete collapse from now.Two, Xi Jinping's era further solidifies that the Party continues to shift. This is not a hindsight analysis, but even when the book was written, it was clear that the 2010 CCP was utterly different from the one in 1995, 1979, or 1965, as it is now from 2010. It is important to recount events and disasters of the previous fifty years but the author - and many others - excessively use them to give their interpretations of reality now.Three, some things on human rights and individual freedoms are wrong absolutely. End results in economic or political successes should not be used to either justify them or predictions of failures to announce their futility. Champions of such causes, however, always bear the burden of proving their credentials that they are not prejudiced. The book fails to establish this.In conclusion, the book is a helpful read to understand the pitfalls of standard China analysis we see in abundance these days.","1 个人发现此评论有用","https://www.amazon.com/ap/signin?openid.return_to=https%3A%2F%2Fwww.amazon.com%2Fproduct-reviews%2FB083ZLHL6T%2Fref%3Dcm_cr_getr_d_vote_lft%3Fie%3DUTF8%26reviewerType%3Dall_reviews%26pageSize%3D10%26csrfT%3DhNkUk6PDT4dGF2CTFtGedyOALdfEfRyrUNbUX5hJTQYeAAAAAGQvy6AAAAAB%26reviewId%3DR1V65FIEX7EJ7I&openid.identity=http%3A%2F%2Fspecs.openid.net%2Fauth%2F2.0%2Fidentifier_select&openid.assoc_handle=usflex&openid.mode=checkid_setup&marketPlaceId=ATVPDKIKX0DER&language=zh&openid.claimed_id=http%3A%2F%2Fspecs.openid.net%2Fauth%2F2.0%2Fidentifier_select&openid.ns=http%3A%2F%2Fspecs.openid.net%2Fauth%2F2.0","有帮助","报告","https://www.amazon.com/hz/reviews-render/report-review?ie=UTF8&ref=cm_cr_getr_d_rvw_hlp&csrfT=hNkUk6PDT4dGF2CTFtGedyOALdfEfRyrUNbUX5hJTQYeAAAAAGQvy6AAAAAB&reviewId=R1V65FIEX7EJ7I","显示条评论","0","当前加载评论时遇到问题。请稍后再试。"
"The Huntington Book Depository","4.0 颗星，最多 5 颗星","A nice primer but in need of an update","2020年6月27日 在美国审核","","This is a great book for those who want a solid overview of the history of the Chinese Communist Party and how it has evolved its operations within the political, social, and economic spheres in China. With the collapse of the Soviet Union, there is much less understanding out there at how ""the Party"" and the government are separate entities in a communist system and who does what in society, and this is tailored to show how the system evolved distinctly in China. There are however more current books out there that may be better suited to the specialist looking for what's changing today in China. Would be interesting to see an update of this 2012 edition, with a chapter or two added on the tail end about Xi's consolidation of power and how this impacts the Party today.","报告","https://www.amazon.com/ap/signin?openid.return_to=https%3A%2F%2Fwww.amazon.com%2Fproduct-reviews%2FB083ZLHL6T%2Fref%3Dcm_cr_getr_d_vote_lft%3Fie%3DUTF8%26reviewerType%3Dall_reviews%26pageSize%3D10%26csrfT%3DhNq7HStCi2VzyQR%252FqoMAfsAR3qJecmb2DO%252BmkxOiLLo4AAAAAGQvy6AAAAAB%26reviewId%3DRBJ7VU3XAQB7R&openid.identity=http%3A%2F%2Fspecs.openid.net%2Fauth%2F2.0%2Fidentifier_select&openid.assoc_handle=usflex&openid.mode=checkid_setup&marketPlaceId=ATVPDKIKX0DER&language=zh&openid.claimed_id=http%3A%2F%2Fspecs.openid.net%2Fauth%2F2.0%2Fidentifier_select&openid.ns=http%3A%2F%2Fspecs.openid.net%2Fauth%2F2.0","有帮助","显示条评论","https://www.amazon.com/hz/reviews-render/report-review?ie=UTF8&ref=cm_cr_getr_d_rvw_hlp&csrfT=hNq7HStCi2VzyQR%2FqoMAfsAR3qJecmb2DO%2BmkxOiLLo4AAAAAGQvy6AAAAAB&reviewId=RBJ7VU3XAQB7R","","0","当前加载评论时遇到问题。请稍后再试。"
"Maynard Handley","2.0 颗星，最多 5 颗星","Very disappointing","2010年12月3日 在美国审核","","The most important thing to appreciate about this book is that it is written by a journalist, not an academic, and as such it it riddled with the mindlessness and sensationalization one expects from journalists.I don't want to say that the author has an explicit agenda against China and the party; an agenda would be the product of definite thought. Rather, the author is so thoroughly steeped in the idea that there is one and only one true way to run a country that he simply cannot wrap his head around the concept that in other places, things are done differently. So instead of actual explanations of how the society functions, we are treated to a constant stream of amazement at the ways of those weird foreigners. Pointing out that things are different is fine for the first two pages, after that having the point re-iterated every third sentence becomes tiresome --- there is a reason Bruce McCall's ""In the New Canada, Living is a Way of Life"" is parody.There is, moreover, more (or less) to this style of writing than simply that it is grating --- it reveals that the analysis of the book is intensely problematic. There is, sadly, far too little comparison with the way other societies, both today and in the past, have been governed; for example in the behavior and organizations described, I saw glimpses of Tudor England. A similar problem is that all too-often the party is treated as a monolithic borg. But the Party consists of around 80 million people --- around a quarter of the population of the US. No group of people of that size is monolithic; on the other hand plenty of large organizations (think large corporations) do a reasonably good of projecting a monolithic image. A better analysis would have put this fact front and center. A third complaint along these lines is the constant reiteration of the word ""communist"" as some sort of boogieman. The author seems to want to use the term as a cudgel for switching off debate --- he doesn't, and you the reader don't, have to consider the larger ethical picture here of how the society works because we all know the connotations of the word communist --- and if they are secret communists, well that's that much more nefarious.It seems that few of the other Amazon reviewers agree with my take on this book, but the point is that I was hoping for something at least marginally academic, investigating how such a large organization truly functions and imposes its will; and was very disappointed to have the book be so journalistic.","34 个人发现此评论有用","https://www.amazon.com/ap/signin?openid.return_to=https%3A%2F%2Fwww.amazon.com%2Fproduct-reviews%2FB083ZLHL6T%2Fref%3Dcm_cr_getr_d_vote_lft%3Fie%3DUTF8%26reviewerType%3Dall_reviews%26pageSize%3D10%26csrfT%3DhO8Xd9gdw3FdNz%252Be8RCZUGP9xX6kl9rUkRKIJww7hn7UAAAAAGQvy6AAAAAB%26reviewId%3DR4SFHOWB9PN8Q&openid.identity=http%3A%2F%2Fspecs.openid.net%2Fauth%2F2.0%2Fidentifier_select&openid.assoc_handle=usflex&openid.mode=checkid_setup&marketPlaceId=ATVPDKIKX0DER&language=zh&openid.claimed_id=http%3A%2F%2Fspecs.openid.net%2Fauth%2F2.0%2Fidentifier_select&openid.ns=http%3A%2F%2Fspecs.openid.net%2Fauth%2F2.0","有帮助","报告","https://www.amazon.com/hz/reviews-render/report-review?ie=UTF8&ref=cm_cr_getr_d_rvw_hlp&csrfT=hO8Xd9gdw3FdNz%2Be8RCZUGP9xX6kl9rUkRKIJww7hn7UAAAAAGQvy6AAAAAB&reviewId=R4SFHOWB9PN8Q","显示条评论","0","当前加载评论时遇到问题。请稍后再试。"
"Rolf Dobelli","4.0 颗星，最多 5 颗星","A fascinating explanation of the power behind China's economic might","2012年11月22日 在美国审核","名人堂评论人","Do you feel as if you see ""Made in China"" everywhere you look? Financial Times correspondent Richard McGregor explains why and more. He unveils the secrets of one of the most mysterious organizations in the world: the Chinese Communist Party. If you think a communist organization controlling a major global economy is counterintuitive, you're probably right. But McGregor explains how it all happened - and the roles that various entities such as business, the Chinese military, and the nation's regions and cities continue to play. Understanding how an anticapitalist, communist country became one of the world's economic powerhouses means dealing with a cast of thousands and a dizzying array of names and roles. And time is marching forward as China's new head of state, Xi Jinping, is now replacing Hu Jintao, the leader at the book's center. Still, getAbstract is confident readers will come away with a better understanding of what makes China tick. This is a must-read for executives interested in doing business with China and for anyone who wants to understand the system that governs its one billion people.","报告","https://www.amazon.com/ap/signin?openid.return_to=https%3A%2F%2Fwww.amazon.com%2Fproduct-reviews%2FB083ZLHL6T%2Fref%3Dcm_cr_getr_d_vote_lft%3Fie%3DUTF8%26reviewerType%3Dall_reviews%26pageSize%3D10%26csrfT%3DhBoryG7lsorQ7wfIV%252FU4tpLPziCDeyMMi7gkZxugjxadAAAAAGQvy6AAAAAB%26reviewId%3DRR87HQOPJVLO1&openid.identity=http%3A%2F%2Fspecs.openid.net%2Fauth%2F2.0%2Fidentifier_select&openid.assoc_handle=usflex&openid.mode=checkid_setup&marketPlaceId=ATVPDKIKX0DER&language=zh&openid.claimed_id=http%3A%2F%2Fspecs.openid.net%2Fauth%2F2.0%2Fidentifier_select&openid.ns=http%3A%2F%2Fspecs.openid.net%2Fauth%2F2.0","有帮助","显示条评论","https://www.amazon.com/hz/reviews-render/report-review?ie=UTF8&ref=cm_cr_getr_d_rvw_hlp&csrfT=hBoryG7lsorQ7wfIV%2FU4tpLPziCDeyMMi7gkZxugjxadAAAAAGQvy6AAAAAB&reviewId=RR87HQOPJVLO1","","0","当前加载评论时遇到问题。请稍后再试。"
"Charles Bookman","4.0 颗星，最多 5 颗星","How does China's Free Market Economics Square with its Communist Ideology?","2016年1月23日 在美国审核","","China’s sustained double-digit growth is one of the great economic success stories of our time. How did China, with its professed Communist ideology and revolutionary history, accomplish such a feat? How do ordinary Chinese as well as their leaders square free-wheeling, free-market success with the collectivist and egalitarian ideals of the Communist movement? In “The Party”, Richard McGregor draws on nearly a decade of business and political reporting in China to find out how the system accommodates a market economy within the big tent of communist ideals. He explains how the system works. “The Party” is an important text for those who seek to understand modern China. Read more at:http://bookmanreader.blogspot.com/2016/01/the-party-secret-world-of-chinas.html","报告","https://www.amazon.com/ap/signin?openid.return_to=https%3A%2F%2Fwww.amazon.com%2Fproduct-reviews%2FB083ZLHL6T%2Fref%3Dcm_cr_getr_d_vote_lft%3Fie%3DUTF8%26reviewerType%3Dall_reviews%26pageSize%3D10%26csrfT%3DhB1QuA9RtEjUtOkblcd3iS0CoRSZ%252B1W77HJOJjDZahOvAAAAAGQvy6AAAAAB%26reviewId%3DRIMS5N8XECMSY&openid.identity=http%3A%2F%2Fspecs.openid.net%2Fauth%2F2.0%2Fidentifier_select&openid.assoc_handle=usflex&openid.mode=checkid_setup&marketPlaceId=ATVPDKIKX0DER&language=zh&openid.claimed_id=http%3A%2F%2Fspecs.openid.net%2Fauth%2F2.0%2Fidentifier_select&openid.ns=http%3A%2F%2Fspecs.openid.net%2Fauth%2F2.0","有帮助","显示条评论","https://www.amazon.com/hz/reviews-render/report-review?ie=UTF8&ref=cm_cr_getr_d_rvw_hlp&csrfT=hB1QuA9RtEjUtOkblcd3iS0CoRSZ%2B1W77HJOJjDZahOvAAAAAGQvy6AAAAAB&reviewId=RIMS5N8XECMSY","","0","当前加载评论时遇到问题。请稍后再试。"
"Loyd Eskildson","4.0 颗星，最多 5 颗星","Informative -","2010年7月9日 在美国审核","","McGregor's ""The Party"" provides important insight into how China operates. Membership in the Chinese Communist Party (CCP) exceeds 73 million (about 12% of adults), and controls every level of government, as well as official religions, the media, large, state-owned businesses, and the various other allowed political parties. Ironically, the CCP came into power as a result of popular abhorrence of corruption, and it is now likewise riddled itself. Its foundation has move from preaching equality to allowing incomes as unequal as anywhere in Asia, and from despising to enabling business leaders. Nonetheless, the World Bank credits China with lowering the number of its poor by one-half billion from 1981 to 2004. Star students and wealthy entrepreneurs are sought out for CCP membership.Public institution officials receive periodic training from a network of 2,800 schools before becoming eligible for promotion; accusations of criminal conduct are first investigated by the Party, and it decides whether to take action. Leaders and budgets of the 8 approved 'democratic parties' are set by the CCP. Things that formerly required Party approval (where one lives, works, studies, marries) have largely become acts of choice in urban areas, less so in rural zones.Corruption is a major problem, especially in Shanghai, possibly because it has become a socialism showcase. Positions in customs, taxation, land sales, infrastructure development, procurement, and regulation are especially vulnerable.","3 个人发现此评论有用","https://www.amazon.com/ap/signin?openid.return_to=https%3A%2F%2Fwww.amazon.com%2Fproduct-reviews%2FB083ZLHL6T%2Fref%3Dcm_cr_getr_d_vote_lft%3Fie%3DUTF8%26reviewerType%3Dall_reviews%26pageSize%3D10%26csrfT%3DhFsWVIOpTUE65EBlPM5ypTKtZeyFyncPHHz4cFQz2x9%252BAAAAAGQvy6AAAAAB%26reviewId%3DR30O84SVIF5KWD&openid.identity=http%3A%2F%2Fspecs.openid.net%2Fauth%2F2.0%2Fidentifier_select&openid.assoc_handle=usflex&openid.mode=checkid_setup&marketPlaceId=ATVPDKIKX0DER&language=zh&openid.claimed_id=http%3A%2F%2Fspecs.openid.net%2Fauth%2F2.0%2Fidentifier_select&openid.ns=http%3A%2F%2Fspecs.openid.net%2Fauth%2F2.0","有帮助","报告","https://www.amazon.com/hz/reviews-render/report-review?ie=UTF8&ref=cm_cr_getr_d_rvw_hlp&csrfT=hFsWVIOpTUE65EBlPM5ypTKtZeyFyncPHHz4cFQz2x9%2BAAAAAGQvy6AAAAAB&reviewId=R30O84SVIF5KWD","显示条评论","0","当前加载评论时遇到问题。请稍后再试。"
"Samuel J. Sharp","4.0 颗星，最多 5 颗星","Many Small Stories Inside an Informative Book","2012年10月9日 在美国审核","","This is a very informative and thorough look at modern China and the dominant role played by the Communist party in China's political and business activities. McGregor paints the picture of a party obsessed with control and information by telling many individual stories based on interviews he conducted. This means that some chapters are more interesting than others in part because of the individuals McGregor could locate for interviews. Chapters 2 and 7 which focus on Chinese enterprise were particularly interesting whereas chapter 3 on party personnel was a slog. McGregor is a serious journalist who provides lots of information without injecting his personal views.  Thus ""The Party"" is not one the many recent books on China that are intended to scare or enrage rather than inform readers.The reliance on interviews does make for a book that feels ""zoomed in"" on particular people and issues, rather than a comprehensive and broad look at China and the party as a whole. Nonetheless, this is still a very clear window into how China works and I recommend it alongside other books like ""Capitalism Without Democracy"" and ""The Beijing Consensus"" that are equally helpful in understanding modern China.","1 个人发现此评论有用","https://www.amazon.com/ap/signin?openid.return_to=https%3A%2F%2Fwww.amazon.com%2Fproduct-reviews%2FB083ZLHL6T%2Fref%3Dcm_cr_getr_d_vote_lft%3Fie%3DUTF8%26reviewerType%3Dall_reviews%26pageSize%3D10%26csrfT%3DhGytwjEm%252FfjzNgyWiKEeT5ksurUQ1P0%252BTgCaxMp07nnMAAAAAGQvy6AAAAAB%26reviewId%3DR3MQV9M10LFBHX&openid.identity=http%3A%2F%2Fspecs.openid.net%2Fauth%2F2.0%2Fidentifier_select&openid.assoc_handle=usflex&openid.mode=checkid_setup&marketPlaceId=ATVPDKIKX0DER&language=zh&openid.claimed_id=http%3A%2F%2Fspecs.openid.net%2Fauth%2F2.0%2Fidentifier_select&openid.ns=http%3A%2F%2Fspecs.openid.net%2Fauth%2F2.0","有帮助","报告","https://www.amazon.com/hz/reviews-render/report-review?ie=UTF8&ref=cm_cr_getr_d_rvw_hlp&csrfT=hGytwjEm%2FfjzNgyWiKEeT5ksurUQ1P0%2BTgCaxMp07nnMAAAAAGQvy6AAAAAB&reviewId=R3MQV9M10LFBHX","显示条评论","0","当前加载评论时遇到问题。请稍后再试。"
"Rajiv Thind","3.0 颗星，最多 5 颗星","Yellow Journalism about Red China","2013年6月8日 在美国审核","","***3 Stars*** or B-This book is rich in information. However, I think what ruins this book is its alarmist tone. One may as well assume--as millions of Chinese certainly will--that the book was written with secret funding from  major Western governments' foreign policy departments to undermine the Chinese economic miracle. Author seems extremely exasperated that despite its ""Leninist"" and ""Soviet"" style political system China has reaped the rewards of free market economics.The author repeatedly charges that The Communist Party is controlled by an ""Elite"". Which country, community, society or political system does not have an elite of one sort or another? Even your run-off-the-mill Conspiracy Theorist can talk to you for hours about the Bilderberg Group, Catholic Church, Bohemian Grove, Rothchilds and so on....I'm sure millions of Chinese who have been lifted out of debilitating and soul-destroying poverty, lack and hunger are nothing but thankful to The Party. Okay, China did it without embracing Liberal democracy, and some concerns about China's rising military expenditure (and its aggressive territorial claims) may be justified. But there is no reason to demonize almost every aspect of the recent Chinese reforms and economic success led by The Party.Also, in the third chapter (with a cheesy title of ""Keepers of the File"") the author presents Chinese Central Organization Department as some kind of all-seeing sinister mammoth that has no counterpart in any Western country. But such amorphous central government bodies can be traced in many so called democracies; some would name the United States Department of Homeland Security as a worthy candidate. Although, I suppose, it is the job of governments to keep an eye on domestic activities in order to maintain peace and order. This overseeing role does not always have to have sinister goals.I would see the modern Chinese Communist Party as a strict and stern parent, who refuses to give his/her children the freedom to be frolicsome because the times are tough and full of huge challenges. But eventually, it all works out when the children with such upbringing end up becoming successful and responsible adults.As for ""Democracy"", I personally think, with time, China will afford its citizens more political freedoms. Take South Korea as a model for China. When, after the Second World War, South Korea embraced economic liberalism its government retained many dictatorial elements. But after a few decades South Korea embraced political liberalism as well, and now it is a robust liberal democracy. China too will get there, by and by.Lastly, as the author himself admits, it took the Western Industrial Revolution at least a hundred years to achieve the same level of progress and development that the Chinese Industrial Revolution has achieved in only three decades. So, instead of being jealous, paranoid and insecure, let's applaud and be inspired by the Chinese success in making life better for millions of men, women and children of the human race.","9 个人发现此评论有用","https://www.amazon.com/ap/signin?openid.return_to=https%3A%2F%2Fwww.amazon.com%2Fproduct-reviews%2FB083ZLHL6T%2Fref%3Dcm_cr_getr_d_vote_lft%3Fie%3DUTF8%26reviewerType%3Dall_reviews%26pageSize%3D10%26csrfT%3DhH9BRuog1V2Rvjyx%252FDjCjvLiN9nCtODGMu0qjJI514l5AAAAAGQvy6AAAAAB%26reviewId%3DRBTC7A88XN9E&openid.identity=http%3A%2F%2Fspecs.openid.net%2Fauth%2F2.0%2Fidentifier_select&openid.assoc_handle=usflex&openid.mode=checkid_setup&marketPlaceId=ATVPDKIKX0DER&language=zh&openid.claimed_id=http%3A%2F%2Fspecs.openid.net%2Fauth%2F2.0%2Fidentifier_select&openid.ns=http%3A%2F%2Fspecs.openid.net%2Fauth%2F2.0","有帮助","报告","https://www.amazon.com/hz/reviews-render/report-review?ie=UTF8&ref=cm_cr_getr_d_rvw_hlp&csrfT=hH9BRuog1V2Rvjyx%2FDjCjvLiN9nCtODGMu0qjJI514l5AAAAAGQvy6AAAAAB&reviewId=RBTC7A88XN9E","显示条评论","0","当前加载评论时遇到问题。请稍后再试。"
"Diz","5.0 颗星，最多 5 颗星","Decay and Evolution","2011年3月25日 在美国审核","","This is a really fascinating account of the current state of China and the Chinese Communist Party. Too often, accounts of China in the West take a surface view of this burgeoning economy and assume that development must, in many ways, rely on the economic, if not social, models of the West, particularly after the demise of Russian communism. This relatively short book paints a far more subtle, nuanced and inclusive picture of a country and it's ruling party as both 'decaying and evolving' in the face of internal and external challenges.In eight clearly defined chapters, McGregor considers 'The Party and the State', 'The Party and Business', 'The Party and Personnel', 'The Party and the Gun', 'The Party and Corruption', 'The Party and the Regions', 'The Party and Capitalism' and 'The Party and History'. What comes across is a picture of a ruling central organisation that is ubiquitous, fragile, subtle and, at the same time, hugely adaptable. The Party is not synonymous with the government, nor the state. 'The Party', as the quote at the beginning of Chapter 1 says 'is like God. He is everywhere. You just can't see him'. It has survived horrendous famines, the Cultural Revolution, Tienanmen Square and, so far, many of the vicissitudes assailing Western economies. How it has managed this, and how it may continue to do so for some time to come, is laid out in each chapter as Mr McGregor takes a core element of Chinese society and investigates it's relationship to the Party, using an illuminating mixture of history, example and anecdote.Many western investors in Chinese businesses assume that China is, in some sense, becoming a capitalist society, but this is to completely miss the intimate relationship between the Party and all levels of the economy. It is assumed that China's state-run sector will suffer the same fate as such enterprises in Russia, but this is to miss both the flexibility of the organisation and the readiness to learn from the mistakes of others. It is far from perfect, of course, but it is more open to change, as long as this change is supervised and sanctioned by the Party, than many Western commentators realise.Overall, what comes across is both, in some ways, rather admirable and Orwellian. But the point is continually made that anyone who thinks that China is simply adopting a Western 'free market' strategy is seriously mistaken - the role and actions of the Party remain central. Again, the Party can both 'decay and evolve'.","4 个人发现此评论有用","https://www.amazon.com/ap/signin?openid.return_to=https%3A%2F%2Fwww.amazon.com%2Fproduct-reviews%2FB083ZLHL6T%2Fref%3Dcm_cr_getr_d_vote_lft%3Fie%3DUTF8%26reviewerType%3Dall_reviews%26pageSize%3D10%26csrfT%3DhHF4IPL2Y8qOQLsmkglWxBDhPdazFA7b%252Fb7aU5iMVkE5AAAAAGQvy6AAAAAB%26reviewId%3DR10B6FCYXCRPY3&openid.identity=http%3A%2F%2Fspecs.openid.net%2Fauth%2F2.0%2Fidentifier_select&openid.assoc_handle=usflex&openid.mode=checkid_setup&marketPlaceId=ATVPDKIKX0DER&language=zh&openid.claimed_id=http%3A%2F%2Fspecs.openid.net%2Fauth%2F2.0%2Fidentifier_select&openid.ns=http%3A%2F%2Fspecs.openid.net%2Fauth%2F2.0","有帮助","报告","https://www.amazon.com/hz/reviews-render/report-review?ie=UTF8&ref=cm_cr_getr_d_rvw_hlp&csrfT=hHF4IPL2Y8qOQLsmkglWxBDhPdazFA7b%2Fb7aU5iMVkE5AAAAAGQvy6AAAAAB&reviewId=R10B6FCYXCRPY3","显示条评论","0","当前加载评论时遇到问题。请稍后再试。"
