"a-profile-name","a-icon-alt","a-size-base","a-size-base 2","a-size-mini","a-size-base 3","a-size-base 4","a-button-text href","cr-helpful-text","a-size-base 5","a-size-base href 2","a-size-base 6","review-comment-count","a-alert-heading"
"John M.","5.0 颗星，最多 5 颗星","Insider's Book","2014年6月27日 在美国审核","已确认购买","I live in China . . . I can say I know this place pretty well, which is a tough claim to make. If you don't live here, and don't have first hand knowledge, but you've been really following China over the years - you'll enjoy this book. I give it a 5-star, and it deserves this rating . . . but you should have a good understanding of what's been happening with China since Mao died in 1976 -to the present ... in order to fully appreciate this book.  Go For it if you want to know more about the REAL CHINA","1 个人发现此评论有用","https://www.amazon.com/ap/signin?openid.return_to=https%3A%2F%2Fwww.amazon.com%2Fproduct-reviews%2FB083ZLHL6T%2Fref%3Dcm_cr_getr_d_vote_lft%3Fie%3DUTF8%26reviewerType%3Dall_reviews%26pageSize%3D10%26csrfT%3DhPXvHWSfVEtAooumhHRt7vS8a%252BwydNW2sGcFbiiS8EgNAAAAAGQvy5cAAAAB%26reviewId%3DR3NXXRI7LDENRP&openid.identity=http%3A%2F%2Fspecs.openid.net%2Fauth%2F2.0%2Fidentifier_select&openid.assoc_handle=usflex&openid.mode=checkid_setup&marketPlaceId=ATVPDKIKX0DER&language=zh&openid.claimed_id=http%3A%2F%2Fspecs.openid.net%2Fauth%2F2.0%2Fidentifier_select&openid.ns=http%3A%2F%2Fspecs.openid.net%2Fauth%2F2.0","有帮助","报告","https://www.amazon.com/hz/reviews-render/report-review?ie=UTF8&ref=cm_cr_getr_d_rvw_hlp&csrfT=hPXvHWSfVEtAooumhHRt7vS8a%2BwydNW2sGcFbiiS8EgNAAAAAGQvy5cAAAAB&reviewId=R3NXXRI7LDENRP","显示条评论","0","当前加载评论时遇到问题。请稍后再试。"
"Pythagoras","5.0 颗星，最多 5 颗星","Excellent description of the communist party role, function, and major disfunction in China.","2015年11月10日 在美国审核","已确认购买","Finally someone explained the current role and methods of the communist party in China. Many Americans think the communist party is sort of a benign grandfather offering sage advice to the Chinese. As this book makes clear it is all about deception. There is absolutely NO rule of law in China -- the laws are just a front for outsiders. There is almost no freedom of thought or expression in China. Communism is just another failed religion maintained by totalitarianism. Think Spanish Inquisition on steroids. Bound to fail.","报告","https://www.amazon.com/ap/signin?openid.return_to=https%3A%2F%2Fwww.amazon.com%2Fproduct-reviews%2FB083ZLHL6T%2Fref%3Dcm_cr_getr_d_vote_lft%3Fie%3DUTF8%26reviewerType%3Dall_reviews%26pageSize%3D10%26csrfT%3DhG8V7BC6wIUztonilQRt%252FlETuHDC7%252B8s4ltY02d3CKzcAAAAAGQvy5cAAAAB%26reviewId%3DR1P3JYINKH19YE&openid.identity=http%3A%2F%2Fspecs.openid.net%2Fauth%2F2.0%2Fidentifier_select&openid.assoc_handle=usflex&openid.mode=checkid_setup&marketPlaceId=ATVPDKIKX0DER&language=zh&openid.claimed_id=http%3A%2F%2Fspecs.openid.net%2Fauth%2F2.0%2Fidentifier_select&openid.ns=http%3A%2F%2Fspecs.openid.net%2Fauth%2F2.0","有帮助","显示条评论","https://www.amazon.com/hz/reviews-render/report-review?ie=UTF8&ref=cm_cr_getr_d_rvw_hlp&csrfT=hG8V7BC6wIUztonilQRt%2FlETuHDC7%2B8s4ltY02d3CKzcAAAAAGQvy5cAAAAB&reviewId=R1P3JYINKH19YE","","0","当前加载评论时遇到问题。请稍后再试。"
"John z fang","5.0 颗星，最多 5 颗星","Riveting, compelling and informative","2014年2月5日 在美国审核","已确认购买","This is one of the best modern histories of China that I have read in 30 years. As an amateur scholar of international affairs and modern history and a professional businessman in the global economy, I can honestly say that I have read few books more wonderfully researched and written as this one. The author is simultaneously humorous, passionate, astute, sly, hilarious, serious, condemning and erudite! No one who hopes to be successful in the modern world can escape dealing with China in some fashion and no one who hopes to deal with China can truly do so without reading this amazing piece of work. Bravo.","1 个人发现此评论有用","https://www.amazon.com/ap/signin?openid.return_to=https%3A%2F%2Fwww.amazon.com%2Fproduct-reviews%2FB083ZLHL6T%2Fref%3Dcm_cr_getr_d_vote_lft%3Fie%3DUTF8%26reviewerType%3Dall_reviews%26pageSize%3D10%26csrfT%3DhLoD1zB0hCow12SEH6Du1I%252BUf%252BXp5OmQiKyanlxKEtsYAAAAAGQvy5cAAAAB%26reviewId%3DR64VHPM9YGL67&openid.identity=http%3A%2F%2Fspecs.openid.net%2Fauth%2F2.0%2Fidentifier_select&openid.assoc_handle=usflex&openid.mode=checkid_setup&marketPlaceId=ATVPDKIKX0DER&language=zh&openid.claimed_id=http%3A%2F%2Fspecs.openid.net%2Fauth%2F2.0%2Fidentifier_select&openid.ns=http%3A%2F%2Fspecs.openid.net%2Fauth%2F2.0","有帮助","报告","https://www.amazon.com/hz/reviews-render/report-review?ie=UTF8&ref=cm_cr_getr_d_rvw_hlp&csrfT=hLoD1zB0hCow12SEH6Du1I%2BUf%2BXp5OmQiKyanlxKEtsYAAAAAGQvy5cAAAAB&reviewId=R64VHPM9YGL67","显示条评论","0","当前加载评论时遇到问题。请稍后再试。"
"Brian","5.0 颗星，最多 5 颗星","Very well written and in-depth","2013年3月9日 在美国审核","已确认购买","This book is a good example of how a book about political science and economic factors can be made interesting. while giving an in-depth overview of the players within the power circles in China, it also touches on some history and background of how some of the most important players came to be in their positions. The author gives just enough personal stories and anecdotes to make reading a bit more interesting than most books about historical subjects. I recommend this book for anyone who has an interest in learning more about how China has quickly risen to become one of the most important economic and political entities now on the world stage..","1 个人发现此评论有用","https://www.amazon.com/ap/signin?openid.return_to=https%3A%2F%2Fwww.amazon.com%2Fproduct-reviews%2FB083ZLHL6T%2Fref%3Dcm_cr_getr_d_vote_lft%3Fie%3DUTF8%26reviewerType%3Dall_reviews%26pageSize%3D10%26csrfT%3DhOVs4wIjmyTh2Qls7VgZqnQ%252F5NM4NmdXnrxSCSoJucKtAAAAAGQvy5cAAAAB%26reviewId%3DR1DG7KUNJZCKYB&openid.identity=http%3A%2F%2Fspecs.openid.net%2Fauth%2F2.0%2Fidentifier_select&openid.assoc_handle=usflex&openid.mode=checkid_setup&marketPlaceId=ATVPDKIKX0DER&language=zh&openid.claimed_id=http%3A%2F%2Fspecs.openid.net%2Fauth%2F2.0%2Fidentifier_select&openid.ns=http%3A%2F%2Fspecs.openid.net%2Fauth%2F2.0","有帮助","报告","https://www.amazon.com/hz/reviews-render/report-review?ie=UTF8&ref=cm_cr_getr_d_rvw_hlp&csrfT=hOVs4wIjmyTh2Qls7VgZqnQ%2F5NM4NmdXnrxSCSoJucKtAAAAAGQvy5cAAAAB&reviewId=R1DG7KUNJZCKYB","显示条评论","0","当前加载评论时遇到问题。请稍后再试。"
"Dutiful son-in-law","3.0 颗星，最多 5 颗星","Good on how the Chinese party works, not a great read, could have used editing","2016年6月26日 在美国审核","已确认购买","A good book on understanding how the Chinese communist party really works and why things are done the way they often are.  It makes one think about how to feel about what the Chinese government does, proposes to other governments and so on.  Unfortunately the book could have used a stern editor - some of it reads slowly to say the least, some of the details of examples are unnecessary or repetitious, and so on.  So not a good bedtime read as one may fall asleep.","3 个人发现此评论有用","https://www.amazon.com/ap/signin?openid.return_to=https%3A%2F%2Fwww.amazon.com%2Fproduct-reviews%2FB083ZLHL6T%2Fref%3Dcm_cr_getr_d_vote_lft%3Fie%3DUTF8%26reviewerType%3Dall_reviews%26pageSize%3D10%26csrfT%3DhNoeT1jDi46TMONPeflVRQLQ0SsEhCtng8LYZWir7mLAAAAAAGQvy5cAAAAB%26reviewId%3DR2U7K6N74IZR4J&openid.identity=http%3A%2F%2Fspecs.openid.net%2Fauth%2F2.0%2Fidentifier_select&openid.assoc_handle=usflex&openid.mode=checkid_setup&marketPlaceId=ATVPDKIKX0DER&language=zh&openid.claimed_id=http%3A%2F%2Fspecs.openid.net%2Fauth%2F2.0%2Fidentifier_select&openid.ns=http%3A%2F%2Fspecs.openid.net%2Fauth%2F2.0","有帮助","报告","https://www.amazon.com/hz/reviews-render/report-review?ie=UTF8&ref=cm_cr_getr_d_rvw_hlp&csrfT=hNoeT1jDi46TMONPeflVRQLQ0SsEhCtng8LYZWir7mLAAAAAAGQvy5cAAAAB&reviewId=R2U7K6N74IZR4J","显示条评论","0","当前加载评论时遇到问题。请稍后再试。"
"jchopstix","5.0 颗星，最多 5 颗星","The Party","2010年12月15日 在美国审核","已确认购买","报告","显示条评论","https://www.amazon.com/ap/signin?openid.return_to=https%3A%2F%2Fwww.amazon.com%2Fproduct-reviews%2FB083ZLHL6T%2Fref%3Dcm_cr_getr_d_vote_lft%3Fie%3DUTF8%26reviewerType%3Dall_reviews%26pageSize%3D10%26csrfT%3DhEN%252B8obZc37%252B%252BdtWIC6flsBCHOJJgowyd%252BIr0IP9PtZkAAAAAGQvy5cAAAAB%26reviewId%3DR16QSYW7V3QJ3S&openid.identity=http%3A%2F%2Fspecs.openid.net%2Fauth%2F2.0%2Fidentifier_select&openid.assoc_handle=usflex&openid.mode=checkid_setup&marketPlaceId=ATVPDKIKX0DER&language=zh&openid.claimed_id=http%3A%2F%2Fspecs.openid.net%2Fauth%2F2.0%2Fidentifier_select&openid.ns=http%3A%2F%2Fspecs.openid.net%2Fauth%2F2.0","有帮助","","https://www.amazon.com/hz/reviews-render/report-review?ie=UTF8&ref=cm_cr_getr_d_rvw_hlp&csrfT=hEN%2B8obZc37%2B%2BdtWIC6flsBCHOJJgowyd%2BIr0IP9PtZkAAAAAGQvy5cAAAAB&reviewId=R16QSYW7V3QJ3S","","0","当前加载评论时遇到问题。请稍后再试。"
"seth mallamo","5.0 颗星，最多 5 颗星","The Missing Piece of the Puzzle","2010年9月4日 在美国审核","已确认购买","The perspectives, sources and discussions this book provides are essential for anyone to understand political life in China and all the myriad ways in which it effects life here. On the surface, nearly all Chinese believe that the CCP is the sole protector of the Chinese nation and its culture and as a result enjoys enormous support at home. Probe a little deeper into individual issues and the gaps in this theory become self evident. This book goes a long way in exposing and explaining the Party's tenuous hold on power.","报告","https://www.amazon.com/ap/signin?openid.return_to=https%3A%2F%2Fwww.amazon.com%2Fproduct-reviews%2FB083ZLHL6T%2Fref%3Dcm_cr_getr_d_vote_lft%3Fie%3DUTF8%26reviewerType%3Dall_reviews%26pageSize%3D10%26csrfT%3DhLrkEyCBDSKytJukwgElB56%252BHw11HekVXOMPCXH9KSQ2AAAAAGQvy5cAAAAB%26reviewId%3DR3IFK9T87CFLFU&openid.identity=http%3A%2F%2Fspecs.openid.net%2Fauth%2F2.0%2Fidentifier_select&openid.assoc_handle=usflex&openid.mode=checkid_setup&marketPlaceId=ATVPDKIKX0DER&language=zh&openid.claimed_id=http%3A%2F%2Fspecs.openid.net%2Fauth%2F2.0%2Fidentifier_select&openid.ns=http%3A%2F%2Fspecs.openid.net%2Fauth%2F2.0","有帮助","显示条评论","https://www.amazon.com/hz/reviews-render/report-review?ie=UTF8&ref=cm_cr_getr_d_rvw_hlp&csrfT=hLrkEyCBDSKytJukwgElB56%2BHw11HekVXOMPCXH9KSQ2AAAAAGQvy5cAAAAB&reviewId=R3IFK9T87CFLFU","","0","当前加载评论时遇到问题。请稍后再试。"
"NonFictionLover","5.0 颗星，最多 5 颗星","""Wow"" and ""Thank you, Richard""","2011年6月20日 在美国审核","已确认购买","In one word- Amazed.  This is book is so wonderful,  I learned so much and I am stunned at how much he was able to learn as a foreigner in China.  The government is so tight lipped about their interworkings in the presence of foreigners.  I am so thankful for this book.  I have recommended it to my mother-in-law, friends and co-workers. Very happy with this purchase.  I thought it was a little pricey for an e-book but it is worth every dollar.","2 个人发现此评论有用","https://www.amazon.com/ap/signin?openid.return_to=https%3A%2F%2Fwww.amazon.com%2Fproduct-reviews%2FB083ZLHL6T%2Fref%3Dcm_cr_getr_d_vote_lft%3Fie%3DUTF8%26reviewerType%3Dall_reviews%26pageSize%3D10%26csrfT%3DhJ0FUjr4UE40ylr9ZqHIWv4VPwDsKuz4tyi6mO47V0YPAAAAAGQvy5cAAAAB%26reviewId%3DRZ7QFCDFP5PER&openid.identity=http%3A%2F%2Fspecs.openid.net%2Fauth%2F2.0%2Fidentifier_select&openid.assoc_handle=usflex&openid.mode=checkid_setup&marketPlaceId=ATVPDKIKX0DER&language=zh&openid.claimed_id=http%3A%2F%2Fspecs.openid.net%2Fauth%2F2.0%2Fidentifier_select&openid.ns=http%3A%2F%2Fspecs.openid.net%2Fauth%2F2.0","有帮助","报告","https://www.amazon.com/hz/reviews-render/report-review?ie=UTF8&ref=cm_cr_getr_d_rvw_hlp&csrfT=hJ0FUjr4UE40ylr9ZqHIWv4VPwDsKuz4tyi6mO47V0YPAAAAAGQvy5cAAAAB&reviewId=RZ7QFCDFP5PER","显示条评论","0","当前加载评论时遇到问题。请稍后再试。"
"Newt Gingrich","5.0 颗星，最多 5 颗星","Brilliant and indispensable","2018年12月21日 在美国审核","已确认购买","This is a superb reporters account of modern China and the overwhelmingly central role of the Communist Party. It is a very useful introduction to the realities of a very different system than the one we tend to believe is there.","2 个人发现此评论有用","https://www.amazon.com/ap/signin?openid.return_to=https%3A%2F%2Fwww.amazon.com%2Fproduct-reviews%2FB083ZLHL6T%2Fref%3Dcm_cr_getr_d_vote_lft%3Fie%3DUTF8%26reviewerType%3Dall_reviews%26pageSize%3D10%26csrfT%3DhBG0Wv3I6RygA2X7w6b7hoGctuya4tmiyPxrrQzG9H62AAAAAGQvy5cAAAAB%26reviewId%3DRSDYUSLGX9BA3&openid.identity=http%3A%2F%2Fspecs.openid.net%2Fauth%2F2.0%2Fidentifier_select&openid.assoc_handle=usflex&openid.mode=checkid_setup&marketPlaceId=ATVPDKIKX0DER&language=zh&openid.claimed_id=http%3A%2F%2Fspecs.openid.net%2Fauth%2F2.0%2Fidentifier_select&openid.ns=http%3A%2F%2Fspecs.openid.net%2Fauth%2F2.0","有帮助","报告","https://www.amazon.com/hz/reviews-render/report-review?ie=UTF8&ref=cm_cr_getr_d_rvw_hlp&csrfT=hBG0Wv3I6RygA2X7w6b7hoGctuya4tmiyPxrrQzG9H62AAAAAGQvy5cAAAAB&reviewId=RSDYUSLGX9BA3","显示条评论","0","当前加载评论时遇到问题。请稍后再试。"
"Michael R. Haley","5.0 颗星，最多 5 颗星","Excellent","2012年12月16日 在美国审核","已确认购买","This book offers an experienced author's view, showing clarity of structure, long term motivations, flexibility and abuses of the Chinese Communist Party.  One begins to understand much better the many veils behind which the CPC works at the national, provincial and city levels with specific of people and enterprises.  There is much to admire of China's history and its recent rise -- but much more to understanding the many penalties that Chinese society pays.  Richard McGregor has written a truly excellent book.","报告","https://www.amazon.com/ap/signin?openid.return_to=https%3A%2F%2Fwww.amazon.com%2Fproduct-reviews%2FB083ZLHL6T%2Fref%3Dcm_cr_getr_d_vote_lft%3Fie%3DUTF8%26reviewerType%3Dall_reviews%26pageSize%3D10%26csrfT%3DhIC%252B2hOUIRa9ewaXqr6MxgorO08E5jION0AUdKtbYo%252FHAAAAAGQvy5cAAAAB%26reviewId%3DRIIIRIR270JF3&openid.identity=http%3A%2F%2Fspecs.openid.net%2Fauth%2F2.0%2Fidentifier_select&openid.assoc_handle=usflex&openid.mode=checkid_setup&marketPlaceId=ATVPDKIKX0DER&language=zh&openid.claimed_id=http%3A%2F%2Fspecs.openid.net%2Fauth%2F2.0%2Fidentifier_select&openid.ns=http%3A%2F%2Fspecs.openid.net%2Fauth%2F2.0","有帮助","显示条评论","https://www.amazon.com/hz/reviews-render/report-review?ie=UTF8&ref=cm_cr_getr_d_rvw_hlp&csrfT=hIC%2B2hOUIRa9ewaXqr6MxgorO08E5jION0AUdKtbYo%2FHAAAAAGQvy5cAAAAB&reviewId=RIIIRIR270JF3","","0","当前加载评论时遇到问题。请稍后再试。"
"M. G. Zink","5.0 颗星，最多 5 颗星","Welcome to the Party","2010年8月21日 在美国审核","已确认购买","I spent the last four years living in China, serving as the president of a Chinese bank.  That role took me to 44 cities all across China, where I met hundreds of government officials and Party members. I worked daily with the General Secretary of the bank's Party Committee.  During my time in China I read every major book by any foreigner who had lived and worked in China.  Richard's book, The Party, is the most insightful book I have encountered. If you wish to understand how China is run today and you only have time to read one book, then read this one.","109 个人发现此评论有用","https://www.amazon.com/ap/signin?openid.return_to=https%3A%2F%2Fwww.amazon.com%2Fproduct-reviews%2FB083ZLHL6T%2Fref%3Dcm_cr_getr_d_vote_lft%3Fie%3DUTF8%26reviewerType%3Dall_reviews%26pageSize%3D10%26csrfT%3DhL%252Fsyhshi0tkHoedInisNnB93bxRPNWArHH9TCGJ82uhAAAAAGQvy5gAAAAB%26reviewId%3DR27PZY9FYGLR0Z&openid.identity=http%3A%2F%2Fspecs.openid.net%2Fauth%2F2.0%2Fidentifier_select&openid.assoc_handle=usflex&openid.mode=checkid_setup&marketPlaceId=ATVPDKIKX0DER&language=zh&openid.claimed_id=http%3A%2F%2Fspecs.openid.net%2Fauth%2F2.0%2Fidentifier_select&openid.ns=http%3A%2F%2Fspecs.openid.net%2Fauth%2F2.0","有帮助","报告","https://www.amazon.com/hz/reviews-render/report-review?ie=UTF8&ref=cm_cr_getr_d_rvw_hlp&csrfT=hL%2Fsyhshi0tkHoedInisNnB93bxRPNWArHH9TCGJ82uhAAAAAGQvy5gAAAAB&reviewId=R27PZY9FYGLR0Z","显示条评论","0","当前加载评论时遇到问题。请稍后再试。"
"ron_barnes","4.0 颗星，最多 5 颗星","Communist?","2014年1月22日 在美国审核","已确认购买","Is China really communist?  This book offers an excellent view of the ruling elite.  It sounds more like a kingdom where as long as the elite stay in power and control, then anything is fair game.  As the author quoted ""We are China, we will define what communism is"".  A very in-depth view","报告","https://www.amazon.com/ap/signin?openid.return_to=https%3A%2F%2Fwww.amazon.com%2Fproduct-reviews%2FB083ZLHL6T%2Fref%3Dcm_cr_getr_d_vote_lft%3Fie%3DUTF8%26reviewerType%3Dall_reviews%26pageSize%3D10%26csrfT%3DhIiIjYYs8az8L2bp0DiIbMW4GQD1coSXKE16GxMhh9OEAAAAAGQvy5gAAAAB%26reviewId%3DR3SMLMWNNLYQP3&openid.identity=http%3A%2F%2Fspecs.openid.net%2Fauth%2F2.0%2Fidentifier_select&openid.assoc_handle=usflex&openid.mode=checkid_setup&marketPlaceId=ATVPDKIKX0DER&language=zh&openid.claimed_id=http%3A%2F%2Fspecs.openid.net%2Fauth%2F2.0%2Fidentifier_select&openid.ns=http%3A%2F%2Fspecs.openid.net%2Fauth%2F2.0","有帮助","显示条评论","https://www.amazon.com/hz/reviews-render/report-review?ie=UTF8&ref=cm_cr_getr_d_rvw_hlp&csrfT=hIiIjYYs8az8L2bp0DiIbMW4GQD1coSXKE16GxMhh9OEAAAAAGQvy5gAAAAB&reviewId=R3SMLMWNNLYQP3","","0","当前加载评论时遇到问题。请稍后再试。"
"James M. Hammond","4.0 颗星，最多 5 颗星","Marx lives on.","2013年3月14日 在美国审核","已确认购买","The practical side of communism is exposed in this party expose. The nuts and bolts of making communism ""work"" in the Chinese world of deceit. It demonstrates how an illogical theory of Marxism can be made to work in the real world. If they can make Marxs' theory work, any theory can be made to work, I suppose!","报告","https://www.amazon.com/ap/signin?openid.return_to=https%3A%2F%2Fwww.amazon.com%2Fproduct-reviews%2FB083ZLHL6T%2Fref%3Dcm_cr_getr_d_vote_lft%3Fie%3DUTF8%26reviewerType%3Dall_reviews%26pageSize%3D10%26csrfT%3DhF28gFwXlw1CAGl8bXBzi8UUxOpVOrEbdxWG%252FpYkJDYbAAAAAGQvy5gAAAAB%26reviewId%3DR3MN9IO4U6V2Y9&openid.identity=http%3A%2F%2Fspecs.openid.net%2Fauth%2F2.0%2Fidentifier_select&openid.assoc_handle=usflex&openid.mode=checkid_setup&marketPlaceId=ATVPDKIKX0DER&language=zh&openid.claimed_id=http%3A%2F%2Fspecs.openid.net%2Fauth%2F2.0%2Fidentifier_select&openid.ns=http%3A%2F%2Fspecs.openid.net%2Fauth%2F2.0","有帮助","显示条评论","https://www.amazon.com/hz/reviews-render/report-review?ie=UTF8&ref=cm_cr_getr_d_rvw_hlp&csrfT=hF28gFwXlw1CAGl8bXBzi8UUxOpVOrEbdxWG%2FpYkJDYbAAAAAGQvy5gAAAAB&reviewId=R3MN9IO4U6V2Y9","","0","当前加载评论时遇到问题。请稍后再试。"
"Ingvi Þór Georgsson","4.0 颗星，最多 5 颗星","Interesting","2018年1月11日 在美国审核","已确认购买","Some of the stories not to interesting but overall a great read About the rising tiger in East. It approved.","报告","https://www.amazon.com/ap/signin?openid.return_to=https%3A%2F%2Fwww.amazon.com%2Fproduct-reviews%2FB083ZLHL6T%2Fref%3Dcm_cr_getr_d_vote_lft%3Fie%3DUTF8%26reviewerType%3Dall_reviews%26pageSize%3D10%26csrfT%3DhM%252FsNrUB%252BjVulyc%252F69cj5xjnm4l88a%252FlqJ5IHBILWlkNAAAAAGQvy5gAAAAB%26reviewId%3DR354018FAM23D9&openid.identity=http%3A%2F%2Fspecs.openid.net%2Fauth%2F2.0%2Fidentifier_select&openid.assoc_handle=usflex&openid.mode=checkid_setup&marketPlaceId=ATVPDKIKX0DER&language=zh&openid.claimed_id=http%3A%2F%2Fspecs.openid.net%2Fauth%2F2.0%2Fidentifier_select&openid.ns=http%3A%2F%2Fspecs.openid.net%2Fauth%2F2.0","有帮助","显示条评论","https://www.amazon.com/hz/reviews-render/report-review?ie=UTF8&ref=cm_cr_getr_d_rvw_hlp&csrfT=hM%2FsNrUB%2BjVulyc%2F69cj5xjnm4l88a%2FlqJ5IHBILWlkNAAAAAGQvy5gAAAAB&reviewId=R354018FAM23D9","","0","当前加载评论时遇到问题。请稍后再试。"
"R. B. Lewis","5.0 颗星，最多 5 颗星","A great book!! The author has done his homework, and discusses what he has learned","2014年4月13日 在美国审核","已确认购买","There are many things in this selection that will be obvious to the reader; on the other hand, there are a myriad of items and discussions that will not be apparent to the average reader, and which should be discussed by all of us. How the Chinese government works should be reviewed by all of us, even as they change the rules to suit themselves.","报告","https://www.amazon.com/ap/signin?openid.return_to=https%3A%2F%2Fwww.amazon.com%2Fproduct-reviews%2FB083ZLHL6T%2Fref%3Dcm_cr_getr_d_vote_lft%3Fie%3DUTF8%26reviewerType%3Dall_reviews%26pageSize%3D10%26csrfT%3DhGT5b1RO2vqX0Naw3Vz4%252BwmezqSw5qHVSCZHPXiUXW6uAAAAAGQvy5gAAAAB%26reviewId%3DR1587OMF39VCQD&openid.identity=http%3A%2F%2Fspecs.openid.net%2Fauth%2F2.0%2Fidentifier_select&openid.assoc_handle=usflex&openid.mode=checkid_setup&marketPlaceId=ATVPDKIKX0DER&language=zh&openid.claimed_id=http%3A%2F%2Fspecs.openid.net%2Fauth%2F2.0%2Fidentifier_select&openid.ns=http%3A%2F%2Fspecs.openid.net%2Fauth%2F2.0","有帮助","显示条评论","https://www.amazon.com/hz/reviews-render/report-review?ie=UTF8&ref=cm_cr_getr_d_rvw_hlp&csrfT=hGT5b1RO2vqX0Naw3Vz4%2BwmezqSw5qHVSCZHPXiUXW6uAAAAAGQvy5gAAAAB&reviewId=R1587OMF39VCQD","","0","当前加载评论时遇到问题。请稍后再试。"
"WH","5.0 颗星，最多 5 颗星","Fascinating journey even though we know where it goes","2017年7月21日 在美国审核","已确认购买","McGregor's prose flies, as he takes us inside scene after scene behind the CCP's mission and its tools to make itself indistinguishable from the country itself despite its obvious contradictions with Communism's original commitment to equality","报告","https://www.amazon.com/ap/signin?openid.return_to=https%3A%2F%2Fwww.amazon.com%2Fproduct-reviews%2FB083ZLHL6T%2Fref%3Dcm_cr_getr_d_vote_lft%3Fie%3DUTF8%26reviewerType%3Dall_reviews%26pageSize%3D10%26csrfT%3DhKAZc1o5II69merE8YryV2Aljs3vSdr%252BlSj27f1FlPtzAAAAAGQvy5gAAAAB%26reviewId%3DRP9K02XF4RPZ6&openid.identity=http%3A%2F%2Fspecs.openid.net%2Fauth%2F2.0%2Fidentifier_select&openid.assoc_handle=usflex&openid.mode=checkid_setup&marketPlaceId=ATVPDKIKX0DER&language=zh&openid.claimed_id=http%3A%2F%2Fspecs.openid.net%2Fauth%2F2.0%2Fidentifier_select&openid.ns=http%3A%2F%2Fspecs.openid.net%2Fauth%2F2.0","有帮助","显示条评论","https://www.amazon.com/hz/reviews-render/report-review?ie=UTF8&ref=cm_cr_getr_d_rvw_hlp&csrfT=hKAZc1o5II69merE8YryV2Aljs3vSdr%2BlSj27f1FlPtzAAAAAGQvy5gAAAAB&reviewId=RP9K02XF4RPZ6","","0","当前加载评论时遇到问题。请稍后再试。"
"Y. Jing","5.0 颗星，最多 5 颗星","full of big events in past 10 years -- excellent observation","2011年5月23日 在美国审核","已确认购买","I bought and read the book with curiosity, however i must say it's one of best reading about China and its economic development and its economic and political policy in real examples. The author is an exceptional observer and had shrew view and great access to some insiders.The book is a must-read for anyone who is interested in knowing China and in doing business in China.","2 个人发现此评论有用","https://www.amazon.com/ap/signin?openid.return_to=https%3A%2F%2Fwww.amazon.com%2Fproduct-reviews%2FB083ZLHL6T%2Fref%3Dcm_cr_getr_d_vote_lft%3Fie%3DUTF8%26reviewerType%3Dall_reviews%26pageSize%3D10%26csrfT%3DhI0js0isqmT6%252FKJMF824Lu4bNa4jnv0QanARfHwDU9MEAAAAAGQvy5gAAAAB%26reviewId%3DR3NKG39YIAV5AT&openid.identity=http%3A%2F%2Fspecs.openid.net%2Fauth%2F2.0%2Fidentifier_select&openid.assoc_handle=usflex&openid.mode=checkid_setup&marketPlaceId=ATVPDKIKX0DER&language=zh&openid.claimed_id=http%3A%2F%2Fspecs.openid.net%2Fauth%2F2.0%2Fidentifier_select&openid.ns=http%3A%2F%2Fspecs.openid.net%2Fauth%2F2.0","有帮助","报告","https://www.amazon.com/hz/reviews-render/report-review?ie=UTF8&ref=cm_cr_getr_d_rvw_hlp&csrfT=hI0js0isqmT6%2FKJMF824Lu4bNa4jnv0QanARfHwDU9MEAAAAAGQvy5gAAAAB&reviewId=R3NKG39YIAV5AT","显示条评论","0","当前加载评论时遇到问题。请稍后再试。"
